{
  "$schema": "https://json-schema.org/draft/2020-12/schema",
  "$id": "https://schemas.vulnevidenceops.dev/v1/build-provenance.schema.json",
  "title": "Exact build provenance",
  "type": "object",
  "additionalProperties": false,
  "required": ["schema_version", "provenance_id", "subject_name", "subject_sha256", "source_repository", "source_commit", "source_tree", "source_ref", "builder_identity", "build_type", "invocation_id", "started_at", "finished_at", "materials", "synthetic"],
  "properties": {
    "schema_version": {"const": "vulnevidenceops.build-provenance.v1"},
    "provenance_id": {"type": "string", "minLength": 1},
    "subject_name": {"type": "string", "minLength": 1},
    "subject_sha256": {"type": "string", "pattern": "^[0-9a-f]{64}$"},
    "source_repository": {"type": "string", "minLength": 1},
    "source_commit": {"type": "string", "pattern": "^[0-9a-f]{40}$"},
    "source_tree": {"type": "string", "pattern": "^[0-9a-f]{40}$"},
    "source_ref": {"type": "string", "minLength": 1},
    "builder_identity": {"type": "string", "minLength": 1},
    "build_type": {"type": "string", "minLength": 1},
    "invocation_id": {"type": "string", "minLength": 1},
    "started_at": {"type": "string", "format": "date-time"},
    "finished_at": {"type": "string", "format": "date-time"},
    "materials": {
      "type": "array",
      "minItems": 1,
      "uniqueItems": true,
      "items": {
        "type": "object",
        "additionalProperties": false,
        "required": ["uri", "sha256"],
        "properties": {
          "uri": {"type": "string", "minLength": 1},
          "sha256": {"type": "string", "pattern": "^[0-9a-f]{64}$"}
        }
      }
    },
    "synthetic": {"type": "boolean"}
  }
}
